<?xml version="1.0" encoding="UTF-8"?>
<spdb xsi:noNamespaceSchemaLocation="../../xml/species.xsd" xmlns:xsi="http://www.w3.org/2001/XMLSchema-instance">
  <sp chemicalSymbol="Rn" name="radon" z="-86.0000" mass="404681.2437">
    <muffinTin rmin="2.1566554640687682E-7" radius="2." rinf="29.10040558905078" radialmeshPoints="700"/>
    <atomicState n="1" l="0" kappa="1" occ="2.00000" core="true"/>
    <atomicState n="2" l="0" kappa="1" occ="2.00000" core="true"/>
    <atomicState n="2" l="1" kappa="1" occ="2.00000" core="true"/>
    <atomicState n="2" l="1" kappa="2" occ="4.00000" core="true"/>
    <atomicState n="3" l="0" kappa="1" occ="2.00000" core="true"/>
    <atomicState n="3" l="1" kappa="1" occ="2.00000" core="true"/>
    <atomicState n="3" l="1" kappa="2" occ="4.00000" core="true"/>
    <atomicState n="3" l="2" kappa="2" occ="4.00000" core="true"/>
    <atomicState n="3" l="2" kappa="3" occ="6.00000" core="true"/>
    <atomicState n="4" l="0" kappa="1" occ="2.00000" core="true"/>
    <atomicState n="4" l="1" kappa="1" occ="2.00000" core="true"/>
    <atomicState n="4" l="1" kappa="2" occ="4.00000" core="true"/>
    <atomicState n="4" l="2" kappa="2" occ="4.00000" core="true"/>
    <atomicState n="4" l="2" kappa="3" occ="6.00000" core="true"/>
    <atomicState n="4" l="3" kappa="3" occ="6.00000" core="true"/>
    <atomicState n="4" l="3" kappa="4" occ="8.00000" core="true"/>
    <atomicState n="5" l="0" kappa="1" occ="2.00000" core="true"/>
    <atomicState n="5" l="1" kappa="1" occ="2.00000" core="true"/>
    <atomicState n="5" l="1" kappa="2" occ="4.00000" core="true"/>
    <atomicState n="5" l="2" kappa="2" occ="4.00000" core="false"/>
    <atomicState n="5" l="2" kappa="3" occ="6.00000" core="false"/>
    <atomicState n="6" l="0" kappa="1" occ="2.00000" core="false"/>
    <atomicState n="6" l="1" kappa="1" occ="2.00000" core="false"/>
    <atomicState n="6" l="1" kappa="2" occ="4.00000" core="false"/>
    <basis order="1">
      <wf matchingOrder="0" trialEnergy="0.15" searchE="false"/>
      <exception l="0">
        <wf matchingOrder="0" trialEnergy="0.15" searchE="true"/>
      </exception>
      <exception l="1">
        <wf matchingOrder="0" trialEnergy="0.15" searchE="true"/>
      </exception>
      <exception l="2">
        <wf matchingOrder="0" trialEnergy="0.15" searchE="true"/>
      </exception>
      <exception l="3">
        <wf matchingOrder="0" trialEnergy="0.15" searchE="true"/>
      </exception>
    </basis>
    <lorb l="0">
      <wf matchingOrder="0" trialEnergy="0.15" searchE="true"/>
      <wf matchingOrder="1" trialEnergy="0.15" searchE="true"/>
    </lorb>
    <lorb l="1">
      <wf matchingOrder="0" trialEnergy="0.15" searchE="true"/>
      <wf matchingOrder="1" trialEnergy="0.15" searchE="true"/>
    </lorb>
    <lorb l="2">
      <wf matchingOrder="0" trialEnergy="0.15" searchE="true"/>
      <wf matchingOrder="1" trialEnergy="0.15" searchE="true"/>
    </lorb>
    <lorb l="3">
      <wf matchingOrder="0" trialEnergy="0.15" searchE="true"/>
      <wf matchingOrder="1" trialEnergy="0.15" searchE="true"/>
    </lorb>
    <lorb l="2">
      <wf matchingOrder="0" trialEnergy="0.15" searchE="false"/>
      <wf matchingOrder="1" trialEnergy="0.15" searchE="false"/>
      <wf matchingOrder="0" trialEnergy="-1.7155383331273355" searchE="true"/>
    </lorb>
    <lorb l="0">
      <wf matchingOrder="0" trialEnergy="0.15" searchE="false"/>
      <wf matchingOrder="1" trialEnergy="0.15" searchE="false"/>
      <wf matchingOrder="0" trialEnergy="-0.7334685627369997" searchE="true"/>
    </lorb>
    <lorb l="1">
      <wf matchingOrder="0" trialEnergy="0.15" searchE="false"/>
      <wf matchingOrder="1" trialEnergy="0.15" searchE="false"/>
      <wf matchingOrder="0" trialEnergy="-0.3136413291292162" searchE="true"/>
    </lorb>
    <!-- Exciting code version : 0.9.224-->
    <!-- Description of  method-->
    <!--APW+lo-->
  </sp>
</spdb>
