<?xml version="1.0" encoding="UTF-8"?>
<spdb xsi:noNamespaceSchemaLocation="../../xml/species.xsd" xmlns:xsi="http://www.w3.org/2001/XMLSchema-instance">
  <sp chemicalSymbol="Zn" name="zinc" z="-30.0000" mass="119198.6780">
    <muffinTin rmin="0.365148E-06" radius="2.0000" rinf="31.8739" radialmeshPoints="500"/>
    <atomicState n="1" l="0" kappa="1" occ="2.00000" core="true"/>
    <atomicState n="2" l="0" kappa="1" occ="2.00000" core="true"/>
    <atomicState n="2" l="1" kappa="1" occ="2.00000" core="true"/>
    <atomicState n="2" l="1" kappa="2" occ="4.00000" core="true"/>
    <atomicState n="3" l="0" kappa="1" occ="2.00000" core="true"/>
    <atomicState n="3" l="1" kappa="1" occ="2.00000" core="false"/>
    <atomicState n="3" l="1" kappa="2" occ="4.00000" core="false"/>
    <atomicState n="3" l="2" kappa="2" occ="4.00000" core="false"/>
    <atomicState n="3" l="2" kappa="3" occ="6.00000" core="false"/>
    <atomicState n="4" l="0" kappa="1" occ="2.00000" core="false"/>
    <basis order="1">
      <wf matchingOrder="0" trialEnergy="0.1500" searchE="false"/>
    </basis>
    <lorb l="0">
      <wf matchingOrder="0" trialEnergy="0.1500" searchE="false"/>
      <wf matchingOrder="1" trialEnergy="0.1500" searchE="false"/>
    </lorb>
    <lorb l="1">
      <wf matchingOrder="0" trialEnergy="0.1500" searchE="false"/>
      <wf matchingOrder="1" trialEnergy="0.1500" searchE="false"/>
    </lorb>
    <lorb l="2">
      <wf matchingOrder="0" trialEnergy="0.1500" searchE="false"/>
      <wf matchingOrder="1" trialEnergy="0.1500" searchE="false"/>
    </lorb>
    <lorb l="3">
      <wf matchingOrder="0" trialEnergy="0.1500" searchE="false"/>
      <wf matchingOrder="1" trialEnergy="0.1500" searchE="false"/>
    </lorb>
    <lorb l="1">
      <wf matchingOrder="0" trialEnergy="0.1500" searchE="false"/>
      <wf matchingOrder="1" trialEnergy="0.1500" searchE="false"/>
      <wf matchingOrder="0" trialEnergy="-3.0602" searchE="true"/>
    </lorb>
    <lorb l="2">
      <wf matchingOrder="0" trialEnergy="0.1500" searchE="false"/>
      <wf matchingOrder="1" trialEnergy="0.1500" searchE="false"/>
      <wf matchingOrder="0" trialEnergy="-0.3160" searchE="true"/>
    </lorb>
    <!-- Exciting code version : 0.9.224-->
    <!-- Description of method:-->
    <!-- APW+lo-Legacy -->
  </sp>
</spdb>
