<?xml version="1.0" encoding="UTF-8"?>
<spdb xsi:noNamespaceSchemaLocation="../../xml/species.xsd" xmlns:xsi="http://www.w3.org/2001/XMLSchema-instance">
  <sp chemicalSymbol="Si" name="silicon" z="-14.0000" mass="51196.73454">
    <muffinTin rmin="0.534522E-06" radius="2.0000" rinf="39.5679" radialmeshPoints="400"/>
    <atomicState n="1" l="0" kappa="1" occ="2.00000" core="true"/>
    <atomicState n="2" l="0" kappa="1" occ="2.00000" core="true"/>
    <atomicState n="2" l="1" kappa="1" occ="2.00000" core="true"/>
    <atomicState n="2" l="1" kappa="2" occ="4.00000" core="true"/>
    <atomicState n="3" l="0" kappa="1" occ="2.00000" core="false"/>
    <atomicState n="3" l="1" kappa="1" occ="1.00000" core="false"/>
    <atomicState n="3" l="1" kappa="2" occ="1.00000" core="false"/>
    <basis order="2">
      <wf matchingOrder="0" trialEnergy="0.1500" searchE="false"/>
      <wf matchingOrder="1" trialEnergy="0.1500" searchE="false"/>
      <exception l="0">
        <wf matchingOrder="0" trialEnergy="0.1500" searchE="false"/>
        <wf matchingOrder="0" trialEnergy="0.1500" searchE="false"/>
        <wf matchingOrder="0" trialEnergy="0.1500" searchE="true"/>
      </exception>
      <exception l="1">
        <wf matchingOrder="0" trialEnergy="0.1500" searchE="false"/>
        <wf matchingOrder="0" trialEnergy="0.1500" searchE="false"/>
        <wf matchingOrder="0" trialEnergy="0.1500" searchE="true"/>
      </exception>
      <exception l="2">
        <wf matchingOrder="0" trialEnergy="0.1500" searchE="false"/>
        <wf matchingOrder="0" trialEnergy="0.1500" searchE="false"/>
        <wf matchingOrder="0" trialEnergy="0.1500" searchE="true"/>
      </exception>
    </basis>
    <!-- Exciting code version : 0.9.224-->
    <!-- Description of method:-->
    <!-- SLAPW-3 (experimental) -->
  </sp>
</spdb>
